{
  "schema": "vsf-protocol-evidence-v1",
  "id": "pev_dddddddddddddddddddd",
  "source_app_id": "acme:crm-eu1",
  "origin": "https://crm.example.com",
  "kind": "documented_api",
  "stability": "documented",
  "support": "supported",
  "provenance": {
    "method": "vendor_documentation",
    "reference": "https://docs.example.com/api/profile",
    "recorded_at": 1790000000000,
    "authorization": {
      "basis": "public_documentation"
    }
  },
  "endpoint": {
    "protocol": "http",
    "method": "POST",
    "path_template": "/v1/checkout"
  },
  "shape": {
    "request": [
      {
        "name": "billing.name",
        "type": "string",
        "required": true
      },
      {
        "name": "shipping.name",
        "type": "string",
        "required": true
      },
      {
        "name": "name",
        "type": "string",
        "required": false
      }
    ],
    "response": []
  },
  "promotion": {
    "decision_id": "review.2026-10.fixture",
    "reviewed_by": "prin_aaaaaaaaaaaaaaaaaaaaaaaaaaaaaaaa",
    "documentation_reference": "https://docs.example.com/api/profile",
    "witnesses": ["checkout-w1"]
  }
}
